{
  "$schema": "https://json-schema.org/draft/2020-12/schema",
  "$id": "freetouch/session.schema.json",
  "title": "Free Touch session (also used for Quick Play warm-ups)",
  "type": "object",
  "required": ["id", "name", "exercises"],
  "additionalProperties": false,
  "properties": {
    "id": { "type": "string", "pattern": "^[a-z0-9_.-]+$" },
    "name": { "type": "string" },
    "description": { "type": "string" },
    "category": { "type": "string" },
    "durationMinutes": { "type": "number", "minimum": 1, "maximum": 120, "default": 10 },
    "difficulty": { "enum": ["easy", "medium", "hard", "adaptive"], "default": "medium" },
    "airRoll": { "enum": ["left", "right", "free"], "default": "free" },
    "order": { "enum": ["sequential", "shuffle", "weighted", "weak_spots"], "default": "shuffle" },
    "repsPerExercise": { "type": "integer", "minimum": 1, "description": "Rotate after this many reps; omit to rotate on time only." },
    "endAfterList": { "type": "boolean", "default": false, "description": "Warm-ups: play the list once in order (each entry for its reps), then finish." },
    "exercises": {
      "type": "array",
      "minItems": 1,
      "items": {
        "type": "object",
        "required": ["ref"],
        "additionalProperties": false,
        "properties": {
          "ref": { "type": "string", "description": "A scenario id, a scenario id prefix ending in '*', or a mode id like 'mode:horse'." },
          "weight": { "type": "number", "minimum": 0, "default": 1 },
          "difficulties": { "type": "array", "items": { "enum": ["easy", "medium", "hard"] }, "description": "Only play this exercise at these session difficulties (default: all)." },
          "enabled": { "type": "boolean", "default": true },
          "reps": { "type": "integer", "minimum": 1, "description": "Reps for this entry before moving on (overrides repsPerExercise)." },
          "difficulty": { "enum": ["easy", "medium", "hard"], "description": "Play this entry at this difficulty (overrides the session's)." }
        }
      }
    }
  }
}
